,tweet_id,timestamp,source,text,expanded_urls,rating_numerator,rating_denominator,name,jpg_url,favorite_count,retweet_count,dog_stage,dog_breeds,conf_level
1388,683078886620553216,2016-01-02 00:00:00,"<a href=""http://twitter.com/download/iphone"" rel=""nofollow"">Twitter for iPhone</a>",Here we see a nifty leaping pupper. Feet look deadly. Sad that the holidays are over. 9/10 undeniably huggable https://t.co/ny8mnXhGOW,https://twitter.com/dog_rates/status/683078886620553216/photo/1,9,10,,https://pbs.twimg.com/media/CXrIntsUsAEkv0d.jpg,1852,517,pupper,Eskimo_dog,0.0940442
1389,683030066213818368,2016-01-01 21:00:00,"<a href=""http://twitter.com/download/iphone"" rel=""nofollow"">Twitter for iPhone</a>",This is Lulu. She's contemplating all her unreached 2015 goals and daydreaming of a more efficient tomorrow. 10/10 https://t.co/h3ScYuz77J,https://twitter.com/dog_rates/status/683030066213818368/photo/1,10,10,Lulu,https://pbs.twimg.com/media/CXqcOHCUQAAugTB.jpg,1995,666,Unknown,boxer,0.722218
1392,682750546109968385,2016-01-01 02:00:00,"<a href=""http://twitter.com/download/iphone"" rel=""nofollow"">Twitter for iPhone</a>",Meet Taco. He's a speckled Garnier Fructis. Loves to shadow box. Ears out of control. Friend clearly impressed 9/10 https://t.co/85X1GHohFr,https://twitter.com/dog_rates/status/682750546109968385/photo/1,9,10,Taco,https://pbs.twimg.com/media/CXmd_bsWkAEEXck.jpg,1399,398,Unknown,English_setter,0.947198
1394,682662431982772225,2015-12-31 20:00:00,"<a href=""http://twitter.com/download/iphone"" rel=""nofollow"">Twitter for iPhone</a>",Meet Joey and Izzy. Joey only has one ear that works and Izzy wants 2015 to be over already. Both great pups. 11/10s https://t.co/WgQTIQ93BB,https://twitter.com/dog_rates/status/682662431982772225/photo/1,11,10,Joey,https://pbs.twimg.com/media/CXlN1-EWMAQdwXK.jpg,2806,987,Unknown,beagle,0.4138239999999999
1395,682638830361513985,2015-12-31 19:00:00,"<a href=""http://twitter.com/download/iphone"" rel=""nofollow"">Twitter for iPhone</a>",I have no words. Just a magnificent pup. 12/10 https://t.co/viwWHZgX8j,"https://twitter.com/dog_rates/status/682638830361513985/photo/1,https://twitter.com/dog_rates/status/682638830361513985/photo/1,https://twitter.com/dog_rates/status/682638830361513985/photo/1,https://twitter.com/dog_rates/status/682638830361513985/photo/1",12,10,,https://pbs.twimg.com/media/CXk4W0qWYAMEMEs.jpg,1898,534,Unknown,English_springer,0.440781
1396,682429480204398592,2015-12-31 05:00:00,"<a href=""http://twitter.com/download/iphone"" rel=""nofollow"">Twitter for iPhone</a>","I know we joke around on here, but this is getting really frustrating. We rate dogs. Not T-Rex. Thank you... 8/10 https://t.co/5aFw7SWyxU",https://twitter.com/dog_rates/status/682429480204398592/photo/1,8,10,,https://pbs.twimg.com/media/CXh5_dDWQAIbU-J.jpg,3174,1042,Unknown,whippet,0.594701
1398,682393905736888321,2015-12-31 02:00:00,"<a href=""http://twitter.com/download/iphone"" rel=""nofollow"">Twitter for iPhone</a>",This is Kreg. He's riding an invisible jet ski. 11/10 that's downright legendary https://t.co/BA5AV5dx6Y,https://twitter.com/dog_rates/status/682393905736888321/photo/1,11,10,Kreg,https://pbs.twimg.com/media/CXhZom1UwAA4Zz6.jpg,2063,595,Unknown,vizsla,0.657275
1399,682389078323662849,2015-12-31 02:00:00,"<a href=""http://twitter.com/download/iphone"" rel=""nofollow"">Twitter for iPhone</a>","Meet Brody. He's a Downton Abbey Falsetto. Addicted to grating cheese. He says he can stop but we know he can't
9/10 https://t.co/vBeiQq6SaZ",https://twitter.com/dog_rates/status/682389078323662849/photo/1,9,10,Brody,https://pbs.twimg.com/media/CXhVKtvW8AAyiyK.jpg,1535,423,Unknown,curly-coated_retriever,0.482288
1400,682303737705140231,2015-12-30 20:00:00,"<a href=""http://twitter.com/download/iphone"" rel=""nofollow"">Twitter for iPhone</a>",This is Todo. He's screaming because he doesn't want to wear his sweater or a seat belt. 9/10 gotta buckle up pup https://t.co/Nm8Spw4HbD,https://twitter.com/dog_rates/status/682303737705140231/photo/1,9,10,Todo,https://pbs.twimg.com/media/CXgHoLnWAAA8i52.jpg,2813,883,Unknown,Lakeland_terrier,0.00173092
1401,682259524040966145,2015-12-30 17:00:00,"<a href=""http://twitter.com/download/iphone"" rel=""nofollow"">Twitter for iPhone</a>",Meet Jax. He's an Iglesias Hufflepoof. Quite the jokester. Takes it too far sometimes. Can be very hurtful. 9/10 https://t.co/i5TeG0KYcW,https://twitter.com/dog_rates/status/682259524040966145/photo/1,9,10,Jax,https://pbs.twimg.com/media/CXffar9WYAArfpw.jpg,3796,1077,Unknown,Siberian_husky,0.43967
1405,682032003584274432,2015-12-30 02:00:00,"<a href=""http://twitter.com/download/iphone"" rel=""nofollow"">Twitter for iPhone</a>",This is Ulysses. He likes holding hands and his eyes are magic. 11/10 https://t.co/gPmJHmtgak,https://twitter.com/dog_rates/status/682032003584274432/photo/1,11,10,Ulysses,https://pbs.twimg.com/media/CXcQfUNUQAEwFoQ.jpg,6041,1788,Unknown,schipperke,0.997953
1407,681981167097122816,2015-12-29 23:00:00,"<a href=""http://twitter.com/download/iphone"" rel=""nofollow"">Twitter for iPhone</a>",This is Jimothy. He's a Trinidad Poliwhirl. Father was a velociraptor. Exceptionally unamused. 12/10 would adopt https://t.co/VwdIk0OwVx,https://twitter.com/dog_rates/status/681981167097122816/photo/1,12,10,Jimothy,https://pbs.twimg.com/media/CXbiQHmWcAAt6Lm.jpg,2589,917,Unknown,Labrador_retriever,0.452577
1408,681891461017812993,2015-12-29 17:00:00,"<a href=""http://twitter.com/download/iphone"" rel=""nofollow"">Twitter for iPhone</a>",Say hello to Charlie. He's scholarly af. Quite intimidating with all his pupper knowledge 10/10 even built that fire https://t.co/9KThv6z8u5,https://twitter.com/dog_rates/status/681891461017812993/photo/1,10,10,Charlie,https://pbs.twimg.com/media/CXaQqGbWMAAKEgN.jpg,2266,744,pupper,Chihuahua,0.20357
1409,681694085539872773,2015-12-29 04:00:00,"<a href=""http://twitter.com/download/iphone"" rel=""nofollow"">Twitter for iPhone</a>",This is Bo. He's a Benedoop Cumbersnatch. Seems frustrated with own feet. Portable as hell. 11/10 very solid pupper https://t.co/TONMhRoQh7,https://twitter.com/dog_rates/status/681694085539872773/photo/1,11,10,Bo,https://pbs.twimg.com/media/CXXdJ7CVAAALu23.jpg,11781,3678,pupper,toy_poodle,0.920992
1411,681654059175129088,2015-12-29 01:00:00,"<a href=""http://twitter.com/download/iphone"" rel=""nofollow"">Twitter for iPhone</a>",This is Toffee. He's a happy pupper. Appears dangerously fluffy. Extraordinarily spherical. 12/10 would pet firmly https://t.co/oEXEKt3MHu,https://twitter.com/dog_rates/status/681654059175129088/photo/1,12,10,Toffee,https://pbs.twimg.com/media/CXW4wGHWsAE_eBD.jpg,2410,819,pupper,Pomeranian,0.800538
1412,681610798867845120,2015-12-28 23:00:00,"<a href=""http://twitter.com/download/iphone"" rel=""nofollow"">Twitter for iPhone</a>",*collapses* 12/10 https://t.co/C7M8mnzHIK,https://twitter.com/dog_rates/status/681610798867845120/photo/1,12,10,,https://pbs.twimg.com/media/CXWRZBgWkAEHMea.jpg,1725,416,Unknown,toy_poodle,0.8217040000000001
1413,681579835668455424,2015-12-28 20:00:00,"<a href=""http://twitter.com/download/iphone"" rel=""nofollow"">Twitter for iPhone</a>",This is Apollo. He thought you weren't coming back so he had a mental breakdown. 8/10 we've all been there https://t.co/ojUBrDCHLT,https://twitter.com/dog_rates/status/681579835668455424/photo/1,8,10,Apollo,https://pbs.twimg.com/media/CXV1Ot_W8AEpkQO.jpg,3241,1172,Unknown,Rottweiler,0.760671
1414,681523177663676416,2015-12-28 17:00:00,"<a href=""http://twitter.com/download/iphone"" rel=""nofollow"">Twitter for iPhone</a>",This is Carly. She's actually 2 dogs fused together. Very innovative. Probably has superpowers. 12/10 for double dog https://t.co/GQn2IopLud,https://twitter.com/dog_rates/status/681523177663676416/photo/1,12,10,Carly,https://pbs.twimg.com/media/CXVBtX_WwAEuqbP.jpg,13129,5184,Unknown,Norfolk_terrier,0.205067
1415,681339448655802368,2015-12-28 05:00:00,"<a href=""http://twitter.com/download/iphone"" rel=""nofollow"">Twitter for iPhone</a>",This is Asher. He's not wearing a seatbelt or keeping both paws on the wheel. Absolute menace on the roadways. 9/10 https://t.co/V3SWuHACkh,https://twitter.com/dog_rates/status/681339448655802368/photo/1,9,10,Asher,https://pbs.twimg.com/media/CXSanNkWkAAqR9M.jpg,8542,3692,Unknown,Labrador_retriever,0.0946148999999999
1416,681320187870711809,2015-12-28 03:00:00,"<a href=""http://twitter.com/download/iphone"" rel=""nofollow"">Twitter for iPhone</a>",This is Glacier. He's a very happy pup. Loves to sing in the sunlight. 11/10 https://t.co/jTBPqKgkz7,https://twitter.com/dog_rates/status/681320187870711809/photo/1,11,10,Glacier,https://pbs.twimg.com/media/CXSJGAQUQAAoG9Q.jpg,2403,671,Unknown,Samoyed,0.362596
1418,681297372102656000,2015-12-28 02:00:00,"<a href=""http://twitter.com/download/iphone"" rel=""nofollow"">Twitter for iPhone</a>","This is actually a lion. We only rate dogs. For the last time please only send dogs. Thank u.
12/10 would still pet https://t.co/Pp26dMQxap",https://twitter.com/dog_rates/status/681297372102656000/photo/1,12,10,,https://pbs.twimg.com/media/CXR0WJ_W8AMd_O8.jpg,2952,852,Unknown,Lhasa,0.482401
1419,681281657291280384,2015-12-28 01:00:00,"<a href=""http://twitter.com/download/iphone"" rel=""nofollow"">Twitter for iPhone</a>",Meet Sarge. His parents signed him up for dancing lessons but his true passion is roller coasters 11/10 very petable https://t.co/KvVoBIgkje,https://twitter.com/dog_rates/status/681281657291280384/photo/1,11,10,Sarge,https://pbs.twimg.com/media/CXRmDfWWMAADCdc.jpg,2957,993,Unknown,Saint_Bernard,0.99883
1420,681261549936340994,2015-12-27 23:00:00,"<a href=""http://twitter.com/download/iphone"" rel=""nofollow"">Twitter for iPhone</a>",Say hello to Panda. He's a Quackadilly Shooster. Not amused by your fake ball throwing motion. 9/10 would hug lots https://t.co/wL1iDvbcVk,https://twitter.com/dog_rates/status/681261549936340994/photo/1,9,10,Panda,https://pbs.twimg.com/media/CXRTw_5WMAAUDVp.jpg,1331,235,Unknown,Tibetan_terrier,0.382101
1422,681231109724700672,2015-12-27 21:00:00,"<a href=""http://twitter.com/download/iphone"" rel=""nofollow"">Twitter for iPhone</a>",I just love this pic. 11/10 this pupper is going places https://t.co/P16uhh1PbI,https://twitter.com/dog_rates/status/681231109724700672/photo/1,11,10,,https://pbs.twimg.com/media/CXQ4EwQWwAEVaUf.jpg,2231,436,pupper,Irish_setter,0.406047
1423,681193455364796417,2015-12-27 19:00:00,"<a href=""http://twitter.com/download/iphone"" rel=""nofollow"">Twitter for iPhone</a>",This is Aspen. He's astronomically fluffy. I wouldn't stop petting this dog if the world was ending around me 11/10 https://t.co/oBlgL9nxpx,"https://twitter.com/dog_rates/status/681193455364796417/photo/1,https://twitter.com/dog_rates/status/681193455364796417/photo/1",11,10,Aspen,https://pbs.twimg.com/media/CXQV03pWYAAVniz.jpg,3403,1331,Unknown,Pomeranian,0.992619
1424,680970795137544192,2015-12-27 04:00:00,"<a href=""http://twitter.com/download/iphone"" rel=""nofollow"">Twitter for iPhone</a>",I thought I made this very clear. We only rate dogs. Stop sending other things like this shark. Thank you... 9/10 https://t.co/CXSJZ4Stk3,https://twitter.com/dog_rates/status/680970795137544192/photo/1,9,10,,https://pbs.twimg.com/media/CXNLU6wWkAE0OkJ.jpg,2203,583,Unknown,pug,0.713102
1425,680959110691590145,2015-12-27 03:00:00,"<a href=""http://twitter.com/download/iphone"" rel=""nofollow"">Twitter for iPhone</a>",This is Ozzie. He was doing fine until he lost traction in those festive socks. Now he's tired. 9/10 still killin it https://t.co/u4FYdIRKnY,"https://twitter.com/dog_rates/status/680959110691590145/photo/1,https://twitter.com/dog_rates/status/680959110691590145/photo/1,https://twitter.com/dog_rates/status/680959110691590145/photo/1",9,10,Ozzie,https://pbs.twimg.com/media/CXNAsm6WsAEST9R.jpg,4205,1816,Unknown,pug,0.0443565
1426,680940246314430465,2015-12-27 02:00:00,"<a href=""http://twitter.com/download/iphone"" rel=""nofollow"">Twitter for iPhone</a>",This is Alice. She's an idiot. 4/10 https://t.co/VQXdwJfkyS,https://twitter.com/dog_rates/status/680940246314430465/photo/1,4,10,Alice,https://pbs.twimg.com/media/CXMvio7WQAAPZJj.jpg,2921,935,Unknown,soft-coated_wheaten_terrier,0.289598
1427,680934982542561280,2015-12-27 02:00:00,"<a href=""http://twitter.com/download/iphone"" rel=""nofollow"">Twitter for iPhone</a>",Say hello to Sadie. She's a Tortellini Sidewinder. Very jubilant pup. Seems loyal. Leaves on point. 10/10 petable af https://t.co/g2bTu4ayPl,https://twitter.com/dog_rates/status/680934982542561280/photo/1,10,10,Sadie,https://pbs.twimg.com/media/CXMqwIQWcAA2iE0.jpg,1907,391,Unknown,Labrador_retriever,0.7843979999999999
1428,680913438424612864,2015-12-27 00:00:00,"<a href=""http://twitter.com/download/iphone"" rel=""nofollow"">Twitter for iPhone</a>",Meet Griswold. He's dapper as hell. Already pumped for next Christmas. 11/10 https://t.co/5NrpNDyFzN,https://twitter.com/dog_rates/status/680913438424612864/photo/1,11,10,Griswold,https://pbs.twimg.com/media/CXMXKKHUMAA1QN3.jpg,2203,562,Unknown,Pomeranian,0.615678
1429,680889648562991104,2015-12-26 23:00:00,"<a href=""http://twitter.com/download/iphone"" rel=""nofollow"">Twitter for iPhone</a>",This is Cheesy. It's her birthday. She's patiently waiting to eat her party muffin. 9/10 happy birthday pup https://t.co/cH2H7mch2H,https://twitter.com/dog_rates/status/680889648562991104/photo/1,9,10,Cheesy,https://pbs.twimg.com/media/CXMBhXfWEAA4mMI.jpg,1610,323,Unknown,Shetland_sheepdog,0.876337
1430,680836378243002368,2015-12-26 19:00:00,"<a href=""http://twitter.com/download/iphone"" rel=""nofollow"">Twitter for iPhone</a>",This is Ellie. She's secretly ferocious. 12/10 very deadly pupper https://t.co/BF4BW8LUgb,"https://twitter.com/dog_rates/status/680836378243002368/photo/1,https://twitter.com/dog_rates/status/680836378243002368/photo/1,https://twitter.com/dog_rates/status/680836378243002368/photo/1",12,10,Ellie,https://pbs.twimg.com/media/CXLREjOW8AElfk6.jpg,3175,1182,pupper,Pembroke,0.427781
1431,680801747103793152,2015-12-26 17:00:00,"<a href=""http://twitter.com/download/iphone"" rel=""nofollow"">Twitter for iPhone</a>",Great picture here. Dog on the right panicked &amp; forgot about his tongue. Middle green dog must've fainted. All 10/10 https://t.co/31npKUAox0,https://twitter.com/dog_rates/status/680801747103793152/photo/1,10,10,,https://pbs.twimg.com/media/CXKxkseW8AAjAMY.jpg,2181,739,Unknown,pug,0.99672
1433,680609293079592961,2015-12-26 04:00:00,"<a href=""http://twitter.com/download/iphone"" rel=""nofollow"">Twitter for iPhone</a>",This is Brody. That is his chair. He loves his chair. Never leaves it. 9/10 might be stuck actually https://t.co/WvJRg0XJit,https://twitter.com/dog_rates/status/680609293079592961/photo/1,9,10,Brody,https://pbs.twimg.com/media/CXICiB9UwAE1sKY.jpg,2406,622,Unknown,French_bulldog,0.700764
1435,680497766108381184,2015-12-25 21:00:00,"<a href=""http://twitter.com/download/iphone"" rel=""nofollow"">Twitter for iPhone</a>",Meet Percy. He's a Latvian Yuletide Heineken. Refuses to take off sweater. Kinda feisty. 12/10 would keep in pocket https://t.co/QGM5Fcuv7s,https://twitter.com/dog_rates/status/680497766108381184/photo/1,12,10,Percy,https://pbs.twimg.com/media/CXGdG0aWcAEbOO1.jpg,3875,1728,Unknown,Chihuahua,0.538354
1437,680473011644985345,2015-12-25 19:00:00,"<a href=""http://twitter.com/download/iphone"" rel=""nofollow"">Twitter for iPhone</a>","This is Hector. He thinks he's a hammer. Silly Hector. You're a pupper, not a hammer. 10/10 https://t.co/OdUFuZIXiI",https://twitter.com/dog_rates/status/680473011644985345/photo/1,10,10,Hector,https://pbs.twimg.com/media/CXGGlzvWYAArPfk.jpg,2340,668,pupper,Lakeland_terrier,0.796694
1441,680191257256136705,2015-12-25 01:00:00,"<a href=""http://twitter.com/download/iphone"" rel=""nofollow"">Twitter for iPhone</a>",Here's a sleepy Christmas pupper 11/10 https://t.co/KXg0f8GNQ9,https://twitter.com/dog_rates/status/680191257256136705/photo/1,11,10,,https://pbs.twimg.com/media/CXCGVXyWsAAAVHE.jpg,1972,440,pupper,Brittany_spaniel,0.7332529999999999
1443,680161097740095489,2015-12-24 23:00:00,"<a href=""http://twitter.com/download/iphone"" rel=""nofollow"">Twitter for iPhone</a>",Meet Goliath. He's an example of irony. Head is phenomenally round. Wants to be an ornament. 12/10 would hug gently https://t.co/72Dil0Aktw,https://twitter.com/dog_rates/status/680161097740095489/photo/1,12,10,Goliath,https://pbs.twimg.com/media/CXBq6RPWkAAaNuU.jpg,2136,669,Unknown,bluetick,0.268681
1444,680145970311643136,2015-12-24 22:00:00,"<a href=""http://twitter.com/download/iphone"" rel=""nofollow"">Twitter for iPhone</a>",Say hello to Kawhi. He was doing fine until his hat fell off. He got it back though. 10/10 deep breaths pupper https://t.co/N5pM6WBx7e,"https://twitter.com/dog_rates/status/680145970311643136/photo/1,https://twitter.com/dog_rates/status/680145970311643136/photo/1,https://twitter.com/dog_rates/status/680145970311643136/photo/1",10,10,Kawhi,https://pbs.twimg.com/media/CXBdJxLUsAAWql2.jpg,3306,1555,pupper,miniature_poodle,0.457117
1445,680130881361686529,2015-12-24 21:00:00,"<a href=""http://twitter.com/download/iphone"" rel=""nofollow"">Twitter for iPhone</a>",This is Reggie. His Santa hat is a little big. 10/10 he's still having fun https://t.co/w0dcGXq7qK,https://twitter.com/dog_rates/status/680130881361686529/photo/1,10,10,Reggie,https://pbs.twimg.com/media/CXBPbVtWAAA2Vus.jpg,2109,854,Unknown,Maltese_dog,0.199121
1446,680115823365742593,2015-12-24 20:00:00,"<a href=""http://twitter.com/download/iphone"" rel=""nofollow"">Twitter for iPhone</a>",This is Ozzy. He woke up 2 minutes before he had to be ready for the Christmas party. 9/10 classic Ozzy https://t.co/Kt9vmw0Fap,https://twitter.com/dog_rates/status/680115823365742593/photo/1,9,10,Ozzy,https://pbs.twimg.com/media/CXBBurSWMAELewi.jpg,2491,821,Unknown,pug,0.999365
1447,680100725817409536,2015-12-24 19:00:00,"<a href=""https://about.twitter.com/products/tweetdeck"" rel=""nofollow"">TweetDeck</a>",This pupper is not coming inside until she catches a snowflake on her tongue. 11/10 the determination is palpable https://t.co/lvMYbmKq8H,https://twitter.com/dog_rates/status/680100725817409536/photo/1,11,10,,https://pbs.twimg.com/media/CW-loUBWYAAn2Cb.jpg,3292,1244,pupper,golden_retriever,0.6989609999999999
1449,680070545539371008,2015-12-24 17:00:00,"<a href=""https://about.twitter.com/products/tweetdeck"" rel=""nofollow"">TweetDeck</a>",Say hello to Emmie. She's trapped in an ornament. Tragic af. Looks pretty content tho. Maybe it's meant to be. 9/10 https://t.co/Fh7geodBCU,https://twitter.com/dog_rates/status/680070545539371008/photo/1,9,10,Emmie,https://pbs.twimg.com/media/CW-dU34WQAANBGy.jpg,2379,771,Unknown,Shih-Tzu,0.1218109999999999
1451,679862121895714818,2015-12-24 03:00:00,"<a href=""http://twitter.com/download/iphone"" rel=""nofollow"">Twitter for iPhone</a>","""Dammit hooman I'm jus trynna lik the fler"" 11/10 https://t.co/eRZRI8OTj7",https://twitter.com/dog_rates/status/679862121895714818/photo/1,11,10,,https://pbs.twimg.com/media/CW9a_h1WwAApmAy.jpg,2243,553,Unknown,EntleBucher,0.5232060000000001
1452,679854723806179328,2015-12-24 02:00:00,"<a href=""http://twitter.com/download/iphone"" rel=""nofollow"">Twitter for iPhone</a>",This is Bruce. He's a rare pup. Covered in Frosted Flakes. Nifty gold teeth. Overall good dog. 7/10 would pet firmly https://t.co/RtxxACzZ8A,https://twitter.com/dog_rates/status/679854723806179328/photo/1,7,10,Bruce,https://pbs.twimg.com/media/CW9UQ7oWkAAErmU.jpg,2604,1098,Unknown,chow,0.00230739
1453,679844490799091713,2015-12-24 02:00:00,"<a href=""http://twitter.com/download/iphone"" rel=""nofollow"">Twitter for iPhone</a>",This is Willie. He's floating away and needs your assistance. Please someone help Willie. 10/10 https://t.co/MJqygWqt8X,https://twitter.com/dog_rates/status/679844490799091713/photo/1,10,10,Willie,https://pbs.twimg.com/media/CW9K9VeVAAE0j-x.jpg,2182,686,Unknown,Airedale,0.903832
1454,679828447187857408,2015-12-24 00:00:00,"<a href=""http://twitter.com/download/iphone"" rel=""nofollow"">Twitter for iPhone</a>",Everybody look at this beautiful pupper 13/10 https://t.co/hyAC5Hq9GC,"https://twitter.com/dog_rates/status/679828447187857408/photo/1,https://twitter.com/dog_rates/status/679828447187857408/photo/1,https://twitter.com/dog_rates/status/679828447187857408/photo/1",13,10,,https://pbs.twimg.com/media/CW88XN4WsAAlo8r.jpg,33048,12529,pupper,Chihuahua,0.346545
1455,679777920601223168,2015-12-23 21:00:00,"<a href=""http://twitter.com/download/iphone"" rel=""nofollow"">Twitter for iPhone</a>",This is Rinna. She's melting. 10/10 get inside pupper https://t.co/PA0czwucsb,https://twitter.com/dog_rates/status/679777920601223168/photo/1,10,10,Rinna,https://pbs.twimg.com/media/CW8OYajUMAAPRoF.jpg,2851,991,pupper,bloodhound,0.5288189999999999
1456,679736210798047232,2015-12-23 18:00:00,"<a href=""http://twitter.com/download/iphone"" rel=""nofollow"">Twitter for iPhone</a>",This pup's name is Sabertooth (parents must be cool). Ears for days. Jumps unannounced. 9/10 would pet diligently https://t.co/iazoiNUviP,https://twitter.com/dog_rates/status/679736210798047232/photo/1,9,10,,https://pbs.twimg.com/media/CW7oelWWcAAhyzz.jpg,1907,713,Unknown,French_bulldog,0.319139
1457,679729593985699840,2015-12-23 18:00:00,"<a href=""http://twitter.com/download/iphone"" rel=""nofollow"">Twitter for iPhone</a>",This is Hunter. He was playing with his ball minding his own business. Has no idea what happened to the carpet. 8/10 https://t.co/DbUTDI3u1R,https://twitter.com/dog_rates/status/679729593985699840/photo/1,8,10,Hunter,https://pbs.twimg.com/media/CW7iddWUsAElUC0.jpg,1988,746,Unknown,West_Highland_white_terrier,0.0935148
1458,679722016581222400,2015-12-23 17:00:00,"<a href=""http://twitter.com/download/iphone"" rel=""nofollow"">Twitter for iPhone</a>",This is Mike. He is a Jordanian Frito Pilates. Frowning because he can't see directly in front of him. 8/10 https://t.co/NL5QJwdEpF,https://twitter.com/dog_rates/status/679722016581222400/photo/1,8,10,Mike,https://pbs.twimg.com/media/CW7bkW6WQAAksgB.jpg,1534,425,Unknown,boxer,0.459604
1459,679530280114372609,2015-12-23 05:00:00,"<a href=""http://twitter.com/download/iphone"" rel=""nofollow"">Twitter for iPhone</a>",Guys this really needs to stop. We've been over this way too many times. This is a giraffe. We only rate dogs.. 7/10 https://t.co/yavgkHYPOC,https://twitter.com/dog_rates/status/679530280114372609/photo/1,7,10,,https://pbs.twimg.com/media/CW4tL1vWcAIw1dw.jpg,4355,1876,Unknown,dalmatian,0.750256
1461,679511351870550016,2015-12-23 03:00:00,"<a href=""http://twitter.com/download/iphone"" rel=""nofollow"">Twitter for iPhone</a>",Say hello to William. He makes fun of others because he's terrified of his own deep-seated insecurities. 7/10 https://t.co/bwuV6FlRxr,https://twitter.com/dog_rates/status/679511351870550016/photo/1,7,10,William,https://pbs.twimg.com/media/CW4b-GUWYAAa8QO.jpg,3061,1142,Unknown,Chihuahua,0.761972
1463,679475951516934144,2015-12-23 01:00:00,"<a href=""http://twitter.com/download/iphone"" rel=""nofollow"">Twitter for iPhone</a>",This is Evy. She doesn't want to be a Koala. 9/10 https://t.co/VITeF0Kl9L,https://twitter.com/dog_rates/status/679475951516934144/photo/1,9,10,Evy,https://pbs.twimg.com/media/CW37xZbUoAAUXe5.jpg,1915,578,Unknown,Maltese_dog,0.145742
1464,679462823135686656,2015-12-23 00:00:00,"<a href=""http://twitter.com/download/iphone"" rel=""nofollow"">Twitter for iPhone</a>",Meet Hurley. He's the curly one. He hugs every other dog he sees during his walk. 11/10 for spreading the love https://t.co/M6vqkt2GKV,https://twitter.com/dog_rates/status/679462823135686656/photo/1,11,10,Hurley,https://pbs.twimg.com/media/CW3v1KxW8AAIOuy.jpg,29290,16932,Unknown,toy_poodle,0.62178
1465,679158373988876288,2015-12-22 04:00:00,"<a href=""http://twitter.com/download/iphone"" rel=""nofollow"">Twitter for iPhone</a>",This is Rubio. He has too much skin. 11/10 https://t.co/NLOHmlENag,https://twitter.com/dog_rates/status/679158373988876288/photo/1,11,10,Rubio,https://pbs.twimg.com/media/CWza7kpWcAAdYLc.jpg,19363,7215,Unknown,pug,0.272205
1466,679148763231985668,2015-12-22 03:00:00,"<a href=""http://twitter.com/download/iphone"" rel=""nofollow"">Twitter for iPhone</a>",I know everyone's excited for Christmas but that doesn't mean you can send in reindeer. We only rate dogs... 8/10 https://t.co/eWjWgbOCYL,https://twitter.com/dog_rates/status/679148763231985668/photo/1,8,10,,https://pbs.twimg.com/media/CWzSMmAWsAAyB1u.jpg,2547,919,Unknown,Italian_greyhound,0.302685
1467,679132435750195208,2015-12-22 02:00:00,"<a href=""http://twitter.com/download/iphone"" rel=""nofollow"">Twitter for iPhone</a>",This is Louis. He's a river dancer. His friends think it's badass. All are very supportive. 10/10 for Louis https://t.co/qoIvjKMY58,https://twitter.com/dog_rates/status/679132435750195208/photo/1,10,10,Louis,https://pbs.twimg.com/media/CWzDWOkXAAAP0k7.jpg,2690,1033,Unknown,Scottish_deerhound,0.1946099999999999
1468,679111216690831360,2015-12-22 01:00:00,"<a href=""http://twitter.com/download/iphone"" rel=""nofollow"">Twitter for iPhone</a>",This is officially the greatest yawn of all time. 12/10 https://t.co/4R0Cc0sLVE,https://twitter.com/dog_rates/status/679111216690831360/video/1,12,10,,https://pbs.twimg.com/ext_tw_video_thumb/679111114081370114/pu/img/hFca8BHjRopgD0cM.jpg,5409,2300,Unknown,kelpie,0.189423
1469,679062614270468097,2015-12-21 22:00:00,"<a href=""http://twitter.com/download/iphone"" rel=""nofollow"">Twitter for iPhone</a>",This is Chompsky. He lives up to his name. 11/10 https://t.co/Xl37lQEWd0,"https://twitter.com/dog_rates/status/679062614270468097/photo/1,https://twitter.com/dog_rates/status/679062614270468097/photo/1",11,10,Chompsky,https://pbs.twimg.com/media/CWyD2HGUYAQ1Xa7.jpg,15442,7178,Unknown,schipperke,0.0455186
