,tweet_id,timestamp,source,text,expanded_urls,rating_numerator,rating_denominator,name,jpg_url,favorite_count,retweet_count,dog_stage,dog_breeds,conf_level
2,891815181378084864,2017-07-31 00:00:00,"<a href=""http://twitter.com/download/iphone"" rel=""nofollow"">Twitter for iPhone</a>",This is Archie. He is a rare Norwegian Pouncing Corgo. Lives in the tall grass. You never know when one may strike. 12/10 https://t.co/wUnZnhtVJB,https://twitter.com/dog_rates/status/891815181378084864/photo/1,12,10,Archie,https://pbs.twimg.com/media/DGBdLU1WsAANxJ9.jpg,21973,3464,Unknown,Chihuahua,0.716012
3,891689557279858688,2017-07-30 15:00:00,"<a href=""http://twitter.com/download/iphone"" rel=""nofollow"">Twitter for iPhone</a>",This is Darla. She commenced a snooze mid meal. 13/10 happens to the best of us https://t.co/tD36da7qLQ,https://twitter.com/dog_rates/status/891689557279858688/photo/1,13,10,Darla,https://pbs.twimg.com/media/DF_q7IAWsAEuuN8.jpg,36781,7191,Unknown,Labrador_retriever,0.1680859999999999
4,891327558926688256,2017-07-29 16:00:00,"<a href=""http://twitter.com/download/iphone"" rel=""nofollow"">Twitter for iPhone</a>","This is Franklin. He would like you to stop calling him ""cute."" He is a very fierce shark and should be respected as such. 12/10 #BarkWeek https://t.co/AtUZn91f7f","https://twitter.com/dog_rates/status/891327558926688256/photo/1,https://twitter.com/dog_rates/status/891327558926688256/photo/1",12,10,Franklin,https://pbs.twimg.com/media/DF6hr6BUMAAzZgT.jpg,35180,7715,Unknown,basset,0.555712
5,891087950875897856,2017-07-29 00:00:00,"<a href=""http://twitter.com/download/iphone"" rel=""nofollow"">Twitter for iPhone</a>",Here we have a majestic great white breaching off South Africa's coast. Absolutely h*ckin breathtaking. 13/10 (IG: tucker_marlo) #BarkWeek https://t.co/kQ04fDDRmh,https://twitter.com/dog_rates/status/891087950875897856/photo/1,13,10,,https://pbs.twimg.com/media/DF3HwyEWsAABqE6.jpg,17744,2585,Unknown,Chesapeake_Bay_retriever,0.425595
6,890971913173991426,2017-07-28 16:00:00,"<a href=""http://twitter.com/download/iphone"" rel=""nofollow"">Twitter for iPhone</a>","Meet Jax. He enjoys ice cream so much he gets nervous around it. 13/10 help Jax enjoy more things by clicking below

https://t.co/Zr4hWfAs1H https://t.co/tVJBRMnhxl","https://gofundme.com/ydvmve-surgery-for-jax,https://twitter.com/dog_rates/status/890971913173991426/photo/1",13,10,Jax,https://pbs.twimg.com/media/DF1eOmZXUAALUcq.jpg,10326,1646,Unknown,Appenzeller,0.341703
7,890729181411237888,2017-07-28 00:00:00,"<a href=""http://twitter.com/download/iphone"" rel=""nofollow"">Twitter for iPhone</a>",When you watch your owner call another dog a good boy but then they turn back to you and say you're a great boy. 13/10 https://t.co/v0nONBcwxq,"https://twitter.com/dog_rates/status/890729181411237888/photo/1,https://twitter.com/dog_rates/status/890729181411237888/photo/1",13,10,,https://pbs.twimg.com/media/DFyBahAVwAAhUTd.jpg,56652,15678,Unknown,Pomeranian,0.566142
8,890609185150312448,2017-07-27 16:00:00,"<a href=""http://twitter.com/download/iphone"" rel=""nofollow"">Twitter for iPhone</a>",This is Zoey. She doesn't want to be one of the scary sharks. Just wants to be a snuggly pettable boatpet. 13/10 #BarkWeek https://t.co/9TwLuAGH0b,https://twitter.com/dog_rates/status/890609185150312448/photo/1,13,10,Zoey,https://pbs.twimg.com/media/DFwUU__XcAEpyXI.jpg,24419,3604,Unknown,Irish_terrier,0.4875739999999999
9,890240255349198849,2017-07-26 15:00:00,"<a href=""http://twitter.com/download/iphone"" rel=""nofollow"">Twitter for iPhone</a>",This is Cassie. She is a college pup. Studying international doggo communication and stick theory. 14/10 so elegant much sophisticate https://t.co/t1bfwz5S2A,https://twitter.com/dog_rates/status/890240255349198849/photo/1,14,10,Cassie,https://pbs.twimg.com/media/DFrEyVuW0AAO3t9.jpg,27841,6067,doggo,Pembroke,0.511319
10,890006608113172480,2017-07-26 00:00:00,"<a href=""http://twitter.com/download/iphone"" rel=""nofollow"">Twitter for iPhone</a>",This is Koda. He is a South Australian deckshark. Deceptively deadly. Frighteningly majestic. 13/10 would risk a petting #BarkWeek https://t.co/dVPW0B0Mme,"https://twitter.com/dog_rates/status/890006608113172480/photo/1,https://twitter.com/dog_rates/status/890006608113172480/photo/1",13,10,Koda,https://pbs.twimg.com/media/DFnwSY4WAAAMliS.jpg,26940,6112,Unknown,Samoyed,0.957979
11,889880896479866881,2017-07-25 16:00:00,"<a href=""http://twitter.com/download/iphone"" rel=""nofollow"">Twitter for iPhone</a>",This is Bruno. He is a service shark. Only gets out of the water to assist you. 13/10 terrifyingly good boy https://t.co/u1XPQMl29g,https://twitter.com/dog_rates/status/889880896479866881/photo/1,13,10,Bruno,https://pbs.twimg.com/media/DFl99B1WsAITKsg.jpg,24482,4141,Unknown,French_bulldog,0.377417
12,889665388333682689,2017-07-25 01:00:00,"<a href=""http://twitter.com/download/iphone"" rel=""nofollow"">Twitter for iPhone</a>",Here's a puppo that seems to be on the fence about something haha no but seriously someone help her. 13/10 https://t.co/BxvuXk0UCm,https://twitter.com/dog_rates/status/889665388333682689/photo/1,13,10,,https://pbs.twimg.com/media/DFi579UWsAAatzw.jpg,41870,8303,puppo,Pembroke,0.966327
13,889638837579907072,2017-07-25 00:00:00,"<a href=""http://twitter.com/download/iphone"" rel=""nofollow"">Twitter for iPhone</a>",This is Ted. He does his best. Sometimes that's not enough. But it's ok. 12/10 would assist https://t.co/f8dEDcrKSR,"https://twitter.com/dog_rates/status/889638837579907072/photo/1,https://twitter.com/dog_rates/status/889638837579907072/photo/1",12,10,Ted,https://pbs.twimg.com/media/DFihzFfXsAYGDPR.jpg,23575,3700,Unknown,French_bulldog,0.99165
14,889531135344209921,2017-07-24 17:00:00,"<a href=""http://twitter.com/download/iphone"" rel=""nofollow"">Twitter for iPhone</a>",This is Stuart. He's sporting his favorite fanny pack. Secretly filled with bones only. 13/10 puppared puppo #BarkWeek https://t.co/y70o6h3isq,https://twitter.com/dog_rates/status/889531135344209921/photo/1,13,10,Stuart,https://pbs.twimg.com/media/DFg_2PVW0AEHN3p.jpg,13311,1873,puppo,golden_retriever,0.953442
15,889278841981685760,2017-07-24 00:00:00,"<a href=""http://twitter.com/download/iphone"" rel=""nofollow"">Twitter for iPhone</a>",This is Oliver. You're witnessing one of his many brutal attacks. Seems to be playing with his victim. 13/10 fr*ckin frightening #BarkWeek https://t.co/WpHvrQedPb,https://twitter.com/dog_rates/status/889278841981685760/video/1,13,10,Oliver,https://pbs.twimg.com/ext_tw_video_thumb/889278779352338437/pu/img/VlbFB3v8H8VwzVNY.jpg,22024,4419,Unknown,whippet,0.626152
16,888917238123831296,2017-07-23 00:00:00,"<a href=""http://twitter.com/download/iphone"" rel=""nofollow"">Twitter for iPhone</a>",This is Jim. He found a fren. Taught him how to sit like the good boys. 12/10 for both https://t.co/chxruIOUJN,https://twitter.com/dog_rates/status/888917238123831296/photo/1,12,10,Jim,https://pbs.twimg.com/media/DFYRgsOUQAARGhO.jpg,25529,3742,Unknown,golden_retriever,0.714719
17,888804989199671297,2017-07-22 16:00:00,"<a href=""http://twitter.com/download/iphone"" rel=""nofollow"">Twitter for iPhone</a>",This is Zeke. He has a new stick. Very proud of it. Would like you to throw it for him without taking it. 13/10 would do my best https://t.co/HTQ77yNQ5K,"https://twitter.com/dog_rates/status/888804989199671297/photo/1,https://twitter.com/dog_rates/status/888804989199671297/photo/1",13,10,Zeke,https://pbs.twimg.com/media/DFWra-3VYAA2piG.jpg,22385,3513,Unknown,golden_retriever,0.46976
18,888554962724278272,2017-07-22 00:00:00,"<a href=""http://twitter.com/download/iphone"" rel=""nofollow"">Twitter for iPhone</a>",This is Ralphus. He's powering up. Attempting maximum borkdrive. 13/10 inspirational af https://t.co/YnYAFCTTiK,"https://twitter.com/dog_rates/status/888554962724278272/photo/1,https://twitter.com/dog_rates/status/888554962724278272/photo/1,https://twitter.com/dog_rates/status/888554962724278272/photo/1,https://twitter.com/dog_rates/status/888554962724278272/photo/1",13,10,Ralphus,https://pbs.twimg.com/media/DFTH_O-UQAACu20.jpg,17247,2862,Unknown,Siberian_husky,0.700377
19,888078434458587136,2017-07-20 16:00:00,"<a href=""http://twitter.com/download/iphone"" rel=""nofollow"">Twitter for iPhone</a>",This is Gerald. He was just told he didn't get the job he interviewed for. A h*ckin injustice. 12/10 didn't want the job anyway https://t.co/DK7iDPfuRX,"https://twitter.com/dog_rates/status/888078434458587136/photo/1,https://twitter.com/dog_rates/status/888078434458587136/photo/1",12,10,Gerald,https://pbs.twimg.com/media/DFMWn56WsAAkA7B.jpg,19092,2885,Unknown,French_bulldog,0.995026
20,887705289381826560,2017-07-19 16:00:00,"<a href=""http://twitter.com/download/iphone"" rel=""nofollow"">Twitter for iPhone</a>",This is Jeffrey. He has a monopoly on the pool noodles. Currently running a 'boop for two' midweek sale. 13/10 h*ckin strategic https://t.co/PhrUk20Q64,https://twitter.com/dog_rates/status/887705289381826560/photo/1,13,10,Jeffrey,https://pbs.twimg.com/media/DFHDQBbXgAEqY7t.jpg,26524,4515,Unknown,basset,0.821664
22,887473957103951883,2017-07-19 00:00:00,"<a href=""http://twitter.com/download/iphone"" rel=""nofollow"">Twitter for iPhone</a>",This is Canela. She attempted some fancy porch pics. They were unsuccessful. 13/10 someone help her https://t.co/cLyzpcUcMX,"https://twitter.com/dog_rates/status/887473957103951883/photo/1,https://twitter.com/dog_rates/status/887473957103951883/photo/1",13,10,Canela,https://pbs.twimg.com/media/DFDw2tyUQAAAFke.jpg,59973,14953,Unknown,Pembroke,0.809197
23,887343217045368832,2017-07-18 16:00:00,"<a href=""http://twitter.com/download/iphone"" rel=""nofollow"">Twitter for iPhone</a>",You may not have known you needed to see this today. 13/10 please enjoy (IG: emmylouroo) https://t.co/WZqNqygEyV,https://twitter.com/dog_rates/status/887343217045368832/video/1,13,10,,https://pbs.twimg.com/ext_tw_video_thumb/887343120832229379/pu/img/6HSuFrW1lzI_9Mht.jpg,29481,8774,Unknown,Mexican_hairless,0.330741
24,887101392804085760,2017-07-18 00:00:00,"<a href=""http://twitter.com/download/iphone"" rel=""nofollow"">Twitter for iPhone</a>",This... is a Jubilant Antarctic House Bear. We only rate dogs. Please only send dogs. Thank you... 12/10 would suffocate in floof https://t.co/4Ad1jzJSdp,https://twitter.com/dog_rates/status/887101392804085760/photo/1,12,10,,https://pbs.twimg.com/media/DE-eAq6UwAA-jaE.jpg,26892,4968,Unknown,Samoyed,0.733942
25,886983233522544640,2017-07-17 16:00:00,"<a href=""http://twitter.com/download/iphone"" rel=""nofollow"">Twitter for iPhone</a>",This is Maya. She's very shy. Rarely leaves her cup. 13/10 would find her an environment to thrive in https://t.co/I6oNy0CgiT,"https://twitter.com/dog_rates/status/886983233522544640/photo/1,https://twitter.com/dog_rates/status/886983233522544640/photo/1",13,10,Maya,https://pbs.twimg.com/media/DE8yicJW0AAAvBJ.jpg,30241,6287,Unknown,Chihuahua,0.793469
26,886736880519319552,2017-07-16 23:00:00,"<a href=""http://twitter.com/download/iphone"" rel=""nofollow"">Twitter for iPhone</a>","This is Mingus. He's a wonderful father to his smol pup. Confirmed 13/10, but he needs your help

https://t.co/bVi0Yr4Cff https://t.co/ISvKOSkd5b","https://www.gofundme.com/mingusneedsus,https://twitter.com/dog_rates/status/886736880519319552/photo/1,https://twitter.com/dog_rates/status/886736880519319552/photo/1",13,10,Mingus,https://pbs.twimg.com/media/DE5Se8FXcAAJFx4.jpg,10453,2615,Unknown,kuvasz,0.309706
28,886366144734445568,2017-07-15 23:00:00,"<a href=""http://twitter.com/download/iphone"" rel=""nofollow"">Twitter for iPhone</a>",This is Roscoe. Another pupper fallen victim to spontaneous tongue ejections. Get the BlepiPen immediate. 12/10 deep breaths Roscoe https://t.co/RGE08MIJox,"https://twitter.com/dog_rates/status/886366144734445568/photo/1,https://twitter.com/dog_rates/status/886366144734445568/photo/1",12,10,Roscoe,https://pbs.twimg.com/media/DE0BTnQUwAApKEH.jpg,18484,2613,pupper,French_bulldog,0.999201
29,886258384151887873,2017-07-15 16:00:00,"<a href=""http://twitter.com/download/iphone"" rel=""nofollow"">Twitter for iPhone</a>",This is Waffles. His doggles are pupside down. Unsure how to fix. 13/10 someone assist Waffles https://t.co/xZDA9Qsq1O,https://twitter.com/dog_rates/status/886258384151887873/photo/1,13,10,Waffles,https://pbs.twimg.com/media/DEyfTG4UMAE4aE9.jpg,24437,5254,Unknown,pug,0.943575
30,885984800019947520,2017-07-14 22:00:00,"<a href=""http://twitter.com/download/iphone"" rel=""nofollow"">Twitter for iPhone</a>",Viewer discretion advised. This is Jimbo. He will rip ur finger right h*ckin off. Other dog clearly an accessory. 12/10 pls pet with caution https://t.co/BuveP0uMF1,https://twitter.com/dog_rates/status/885984800019947520/photo/1,12,10,Jimbo,https://pbs.twimg.com/media/DEumeWWV0AA-Z61.jpg,28490,5589,Unknown,Blenheim_spaniel,0.972494
31,885528943205470208,2017-07-13 15:00:00,"<a href=""http://twitter.com/download/iphone"" rel=""nofollow"">Twitter for iPhone</a>",This is Maisey. She fell asleep mid-excavation. Happens to the best of us. 13/10 would pat noggin approvingly https://t.co/tp1kQ8i9JF,https://twitter.com/dog_rates/status/885528943205470208/photo/1,13,10,Maisey,https://pbs.twimg.com/media/DEoH3yvXgAAzQtS.jpg,31474,5306,Unknown,pug,0.369275
32,885311592912609280,2017-07-13 01:00:00,"<a href=""http://twitter.com/download/iphone"" rel=""nofollow"">Twitter for iPhone</a>",RT @dog_rates: This is Lilly. She just parallel barked. Kindly requests a reward now. 13/10 would pet so well https://t.co/SATN4If5H5,"https://twitter.com/dog_rates/status/830583320585068544/photo/1,https://twitter.com/dog_rates/status/830583320585068544/photo/1,https://twitter.com/dog_rates/status/830583320585068544/photo/1,https://twitter.com/dog_rates/status/830583320585068544/photo/1",13,10,Lilly,https://pbs.twimg.com/media/C4bTH6nWMAAX_bJ.jpg,0,15364,Unknown,Labrador_retriever,0.908703
33,885167619883638784,2017-07-12 16:00:00,"<a href=""http://twitter.com/download/iphone"" rel=""nofollow"">Twitter for iPhone</a>",Here we have a corgi undercover as a malamute. Pawbably doing important investigative work. Zero control over tongue happenings. 13/10 https://t.co/44ItaMubBf,"https://twitter.com/dog_rates/status/885167619883638784/photo/1,https://twitter.com/dog_rates/status/885167619883638784/photo/1,https://twitter.com/dog_rates/status/885167619883638784/photo/1,https://twitter.com/dog_rates/status/885167619883638784/photo/1",13,10,,https://pbs.twimg.com/media/DEi_N9qXYAAgEEw.jpg,19181,3652,Unknown,malamute,0.8124819999999999
34,884925521741709313,2017-07-12 00:00:00,"<a href=""http://twitter.com/download/iphone"" rel=""nofollow"">Twitter for iPhone</a>","This is Earl. He found a hat. Nervous about what you think of it. 12/10 it's delightful, Earl https://t.co/MYJvdlNRVa",https://twitter.com/dog_rates/status/884925521741709313/photo/1,12,10,Earl,https://pbs.twimg.com/media/DEfjEaNXkAAtPlj.jpg,67003,14942,Unknown,Italian_greyhound,0.259916
35,884876753390489601,2017-07-11 20:00:00,"<a href=""http://twitter.com/download/iphone"" rel=""nofollow"">Twitter for iPhone</a>",This is Lola. It's her first time outside. Must test the earth and taste the atmosphere. 13/10 you're doing great Lola https://t.co/74TKAUsLkO,"https://twitter.com/dog_rates/status/884876753390489601/photo/1,https://twitter.com/dog_rates/status/884876753390489601/photo/1,https://twitter.com/dog_rates/status/884876753390489601/photo/1,https://twitter.com/dog_rates/status/884876753390489601/photo/1",13,10,Lola,https://pbs.twimg.com/media/DEe2tZXXkAAwyX3.jpg,24295,4639,Unknown,chow,0.822103
36,884562892145688576,2017-07-11 00:00:00,"<a href=""http://twitter.com/download/iphone"" rel=""nofollow"">Twitter for iPhone</a>",This is Kevin. He's just so happy. 13/10 what is your secret Kevin https://t.co/1r4MFCbCX5,https://twitter.com/dog_rates/status/884562892145688576/photo/1,13,10,Kevin,https://pbs.twimg.com/media/DEaZQkfXUAEC7qB.jpg,21233,3895,Unknown,pug,0.5464060000000001
37,884441805382717440,2017-07-10 15:00:00,"<a href=""http://twitter.com/download/iphone"" rel=""nofollow"">Twitter for iPhone</a>","I present to you, Pup in Hat. Pup in Hat is great for all occasions. Extremely versatile. Compact as h*ck. 14/10 (IG: itselizabethgales) https://t.co/vvBOcC2VdC",https://twitter.com/dog_rates/status/884441805382717440/photo/1,14,10,,https://pbs.twimg.com/media/DEYrIZwWsAA2Wo5.jpg,23776,4776,Unknown,Pembroke,0.993225
38,884162670584377345,2017-07-09 21:00:00,"<a href=""http://twitter.com/download/iphone"" rel=""nofollow"">Twitter for iPhone</a>",Meet Yogi. He doesn't have any important dog meetings today he just enjoys looking his best at all times. 12/10 for dangerously dapper doggo https://t.co/YSI00BzTBZ,https://twitter.com/dog_rates/status/884162670584377345/photo/1,12,10,Yogi,https://pbs.twimg.com/media/DEUtQbzW0AUTv_o.jpg,17885,2493,doggo,German_shepherd,0.707046
39,883838122936631299,2017-07-09 00:00:00,"<a href=""http://twitter.com/download/iphone"" rel=""nofollow"">Twitter for iPhone</a>",This is Noah. He can't believe someone made this mess. Got the vacuum out for you though. Offered to help clean pup. 12/10 super good boy https://t.co/V85xujjDDY,https://twitter.com/dog_rates/status/883838122936631299/photo/1,12,10,Noah,https://pbs.twimg.com/media/DEQGFgAXUAAEvfi.jpg,19088,2849,Unknown,Doberman,0.610946
40,883482846933004288,2017-07-08 00:00:00,"<a href=""http://twitter.com/download/iphone"" rel=""nofollow"">Twitter for iPhone</a>","This is Bella. She hopes her smile made you smile. If not, she is also offering you her favorite monkey. 13.5/10 https://t.co/qjrljjt948","https://twitter.com/dog_rates/status/883482846933004288/photo/1,https://twitter.com/dog_rates/status/883482846933004288/photo/1",5,10,Bella,https://pbs.twimg.com/media/DELC9dZXUAADqUk.jpg,40041,8222,Unknown,golden_retriever,0.943082
41,883360690899218434,2017-07-07 16:00:00,"<a href=""http://twitter.com/download/iphone"" rel=""nofollow"">Twitter for iPhone</a>",Meet Grizzwald. He may be the floofiest floofer I ever did see. Lost eyes saving a schoolbus from a volcano erpuption. 13/10 heroic as h*ck https://t.co/rf661IFEYP,https://twitter.com/dog_rates/status/883360690899218434/photo/1,13,10,Grizzwald,https://pbs.twimg.com/media/DEJT3FeXoAAtwUy.jpg,19872,3061,floofer,chow,0.987997
42,883117836046086144,2017-07-07 00:00:00,"<a href=""http://twitter.com/download/iphone"" rel=""nofollow"">Twitter for iPhone</a>","Please only send dogs. We don't rate mechanics, no matter how h*ckin good. Thank you... 13/10 would sneak a pat https://t.co/Se5fZ9wp5E","https://twitter.com/dog_rates/status/883117836046086144/photo/1,https://twitter.com/dog_rates/status/883117836046086144/photo/1",13,10,,https://pbs.twimg.com/media/DEF2-_hXoAAs62q.jpg,32385,5512,Unknown,golden_retriever,0.949562
43,882992080364220416,2017-07-06 15:00:00,"<a href=""http://twitter.com/download/iphone"" rel=""nofollow"">Twitter for iPhone</a>",This is Rusty. He wasn't ready for the first pic. Clearly puppared for the second. 13/10 confirmed great boy https://t.co/tyER0KpdXj,"https://twitter.com/dog_rates/status/882992080364220416/photo/1,https://twitter.com/dog_rates/status/882992080364220416/photo/1",13,10,Rusty,https://pbs.twimg.com/media/DEEEnIqXYAAiJh_.jpg,20911,3229,Unknown,Eskimo_dog,0.4667779999999999
44,882762694511734784,2017-07-06 00:00:00,"<a href=""http://twitter.com/download/iphone"" rel=""nofollow"">Twitter for iPhone</a>",This is Gus. He's quite the cheeky pupper. Already perfected the disinterested wink. 12/10 would let steal my girl https://t.co/D43I96SlVu,https://twitter.com/dog_rates/status/882762694511734784/photo/1,12,10,Gus,https://pbs.twimg.com/media/DEAz_HHXsAA-p_z.jpg,24690,4076,pupper,Labrador_retriever,0.85005
45,882627270321602560,2017-07-05 15:00:00,"<a href=""http://twitter.com/download/iphone"" rel=""nofollow"">Twitter for iPhone</a>",This is Stanley. He has his first swim lesson today. Doggle straps adjusted. Ready to go. 13/10 Phelps is nervous (IG: stanleythe_corgi) https://t.co/Nx52PGwH94,https://twitter.com/dog_rates/status/882627270321602560/photo/1,13,10,Stanley,https://pbs.twimg.com/media/DD-40X3WAAAJPU5.jpg,24523,5042,Unknown,Pembroke,0.542982
46,882268110199369728,2017-07-04 16:00:00,"<a href=""http://twitter.com/download/iphone"" rel=""nofollow"">Twitter for iPhone</a>",This is Alfy. You're witnessing his first watermelon experience. I think it was a success. 13/10 happy 4th Alfy ðŸ‡ºðŸ‡¸ https://t.co/fYP5RlutfA,"https://twitter.com/dog_rates/status/882268110199369728/photo/1,https://twitter.com/dog_rates/status/882268110199369728/photo/1,https://twitter.com/dog_rates/status/882268110199369728/photo/1",13,10,Alfy,https://pbs.twimg.com/media/DD5yKdPW0AArzX8.jpg,39028,9582,Unknown,golden_retriever,0.762211
47,882045870035918850,2017-07-04 01:00:00,"<a href=""http://twitter.com/download/iphone"" rel=""nofollow"">Twitter for iPhone</a>","This is Koko. Her owner, inspired by Barney, recently built a cart for her to use during walks if she got tired. 13/10 rest easy Koko https://t.co/zeDpnsKX7w","https://twitter.com/dog_rates/status/882045870035918850/photo/1,https://twitter.com/dog_rates/status/882045870035918850/photo/1,https://twitter.com/dog_rates/status/882045870035918850/photo/1,https://twitter.com/dog_rates/status/882045870035918850/photo/1",13,10,Koko,https://pbs.twimg.com/media/DD2oCl2WAAEI_4a.jpg,25624,4066,Unknown,golden_retriever,0.00694063
48,881906580714921986,2017-07-03 16:00:00,"<a href=""http://twitter.com/download/iphone"" rel=""nofollow"">Twitter for iPhone</a>",This is Rey. He's a Benebop Cumberfloof. 12/10 dangerously pettable https://t.co/503CgWbhxQ,https://twitter.com/dog_rates/status/881906580714921986/photo/1,12,10,Rey,https://pbs.twimg.com/media/DD0pWm9XcAAeSBL.jpg,21373,2839,Unknown,Weimaraner,0.291539
49,881666595344535552,2017-07-03 00:00:00,"<a href=""http://twitter.com/download/iphone"" rel=""nofollow"">Twitter for iPhone</a>",This is Gary. He couldn't miss this puppertunity for a selfie. Flawless focusing skills. 13/10 would boop intensely https://t.co/7CSWCl8I6s,https://twitter.com/dog_rates/status/881666595344535552/photo/1,13,10,Gary,https://pbs.twimg.com/media/DDxPFwbWAAEbVVR.jpg,44379,8912,Unknown,Saluki,0.529012
50,881536004380872706,2017-07-02 15:00:00,"<a href=""http://twitter.com/download/iphone"" rel=""nofollow"">Twitter for iPhone</a>","Here is a pupper approaching maximum borkdrive. Zooming at never before seen speeds. 14/10 paw-inspiring af 
(IG: puffie_the_chow) https://t.co/ghXBIIeQZF",https://twitter.com/dog_rates/status/881536004380872706/video/1,14,10,,https://pbs.twimg.com/ext_tw_video_thumb/881535971568889856/pu/img/9bawiZ--8FKywTkz.jpg,43275,13347,pupper,Samoyed,0.281463
53,880872448815771648,2017-06-30 19:00:00,"<a href=""http://twitter.com/download/iphone"" rel=""nofollow"">Twitter for iPhone</a>",Ugh not again. We only rate dogs. Please don't send in well-dressed  floppy-tongued street penguins. Dogs only please. Thank you... 12/10 https://t.co/WiAMbTkDPf,https://twitter.com/dog_rates/status/880872448815771648/photo/1,12,10,,https://pbs.twimg.com/media/DDl8zzJW0AAisCJ.jpg,18654,3191,Unknown,Pembroke,0.791416
54,880465832366813184,2017-06-29 16:00:00,"<a href=""http://twitter.com/download/iphone"" rel=""nofollow"">Twitter for iPhone</a>",This is Bella. She had her first beach experience this morning. Complete success. 12/10 would perform a sandy boop https://t.co/4VsFysDmiw,"https://twitter.com/dog_rates/status/880465832366813184/photo/1,https://twitter.com/dog_rates/status/880465832366813184/photo/1,https://twitter.com/dog_rates/status/880465832366813184/photo/1,https://twitter.com/dog_rates/status/880465832366813184/photo/1",12,10,Bella,https://pbs.twimg.com/media/DDgK-J4XUAIEV9W.jpg,24925,5192,Unknown,golden_retriever,0.913255
55,880221127280381952,2017-06-29 00:00:00,"<a href=""http://twitter.com/download/iphone"" rel=""nofollow"">Twitter for iPhone</a>",Meet Jesse. He's a Fetty Woof. His tongue ejects without warning. A true bleptomaniac. 12/10 would snug well https://t.co/fUod0tVmvK,"https://twitter.com/dog_rates/status/880221127280381952/photo/1,https://twitter.com/dog_rates/status/880221127280381952/photo/1",12,10,Jesse,https://pbs.twimg.com/media/DDcscbXU0AIfDzs.jpg,23573,3448,Unknown,Chihuahua,0.238525
56,880095782870896641,2017-06-28 16:00:00,"<a href=""http://twitter.com/download/iphone"" rel=""nofollow"">Twitter for iPhone</a>",Please don't send in photos without dogs in them. We're not @porch_rates. Insubordinate and churlish. Pretty good porch tho 11/10 https://t.co/HauE8M3Bu4,https://twitter.com/dog_rates/status/880095782870896641/photo/1,11,10,,https://pbs.twimg.com/media/DDa6ckbXgAAM1vV.jpg,24232,3634,Unknown,miniature_pinscher,0.120298
57,879862464715927552,2017-06-28 00:00:00,"<a href=""http://twitter.com/download/iphone"" rel=""nofollow"">Twitter for iPhone</a>",This is Romeo. He would like to do an entrance. Requesting your immediate assistance. 13/10 https://t.co/Qh5aEkRQm9,"https://twitter.com/dog_rates/status/879862464715927552/photo/1,https://twitter.com/dog_rates/status/879862464715927552/photo/1,https://twitter.com/dog_rates/status/879862464715927552/photo/1",13,10,Romeo,https://pbs.twimg.com/media/DDXmPrbWAAEKMvy.jpg,19634,2913,Unknown,basset,0.813507
58,879492040517615616,2017-06-27 00:00:00,"<a href=""http://twitter.com/download/iphone"" rel=""nofollow"">Twitter for iPhone</a>",This is Bailey. He thinks you should measure ear length for signs of growth instead. 12/10 https://t.co/IxM9IMKQq8,https://twitter.com/dog_rates/status/879492040517615616/photo/1,12,10,Bailey,https://pbs.twimg.com/media/DDSVWMvXsAEgmMK.jpg,20639,2619,Unknown,German_short-haired_pointer,0.479896
